==54139== Memcheck, a memory error detector
==54139== Copyright (C) 2002-2017, and GNU GPL'd, by Julian Seward et al.
==54139== Using Valgrind-3.18.1 and LibVEX; rerun with -h for copyright info
==54139== Command: ./minishell
==54139== Parent PID: 34836
==54139== 
==54199== 
==54199== HEAP SUMMARY:
==54199==     in use at exit: 214,236 bytes in 455 blocks
==54199==   total heap usage: 702 allocs, 247 frees, 235,206 bytes allocated
==54199== 
==54199== 1 bytes in 1 blocks are still reachable in loss record 1 of 77
==54199==    at 0x4848899: malloc (in /usr/libexec/valgrind/vgpreload_memcheck-amd64-linux.so)
==54199==    by 0x409820: ft_strdup (ft_strdup.c:20)
==54199==    by 0x405D80: create_cmd (create_cmd.c:28)
==54199==    by 0x4059F6: fill_elements (fill_elements.c:60)
==54199==    by 0x405AAC: set_command (set_command.c:41)
==54199==    by 0x40551F: parsing (parsing.c:138)
==54199==    by 0x4015C0: main (main.c:205)
==54199== 
==54199== 5 bytes in 2 blocks are still reachable in loss record 4 of 77
==54199==    at 0x4848899: malloc (in /usr/libexec/valgrind/vgpreload_memcheck-amd64-linux.so)
==54199==    by 0x409820: ft_strdup (ft_strdup.c:20)
==54199==    by 0x405F2E: fill_args (fill_args.c:33)
==54199==    by 0x405A83: set_command (set_command.c:35)
==54199==    by 0x40551F: parsing (parsing.c:138)
==54199==    by 0x4015C0: main (main.c:205)
==54199== 
==54199== 32 bytes in 1 blocks are still reachable in loss record 21 of 77
==54199==    at 0x4848899: malloc (in /usr/libexec/valgrind/vgpreload_memcheck-amd64-linux.so)
==54199==    by 0x405D44: create_cmd (create_cmd.c:24)
==54199==    by 0x4059F6: fill_elements (fill_elements.c:60)
==54199==    by 0x405AAC: set_command (set_command.c:41)
==54199==    by 0x40551F: parsing (parsing.c:138)
==54199==    by 0x4015C0: main (main.c:205)
==54199== 
==54199== 32 bytes in 2 blocks are still reachable in loss record 22 of 77
==54199==    at 0x4848899: malloc (in /usr/libexec/valgrind/vgpreload_memcheck-amd64-linux.so)
==54199==    by 0x409B4C: ft_calloc (ft_calloc.c:25)
==54199==    by 0x405C54: create_args (create_args.c:34)
==54199==    by 0x405E50: fill_args (fill_args.c:20)
==54199==    by 0x405A83: set_command (set_command.c:35)
==54199==    by 0x40551F: parsing (parsing.c:138)
==54199==    by 0x4015C0: main (main.c:205)
==54199== 
==54199== 80 bytes in 2 blocks are still reachable in loss record 27 of 77
==54199==    at 0x4848899: malloc (in /usr/libexec/valgrind/vgpreload_memcheck-amd64-linux.so)
==54199==    by 0x408A2D: ft_lstnew_cmd (ft_lstnew_cmd.c:19)
==54199==    by 0x405ABD: set_command (set_command.c:42)
==54199==    by 0x40551F: parsing (parsing.c:138)
==54199==    by 0x4015C0: main (main.c:205)
==54199== 
==54199== 1,026 bytes in 73 blocks are still reachable in loss record 46 of 77
==54199==    at 0x4848899: malloc (in /usr/libexec/valgrind/vgpreload_memcheck-amd64-linux.so)
==54199==    by 0x409820: ft_strdup (ft_strdup.c:20)
==54199==    by 0x401C4E: new_env_node (setup_shell_exec.c:22)
==54199==    by 0x401BDC: env_init (setup_shell_exec.c:62)
==54199==    by 0x40138E: main (main.c:152)
==54199== 
==54199== 1,752 bytes in 73 blocks are still reachable in loss record 49 of 77
==54199==    at 0x4848899: malloc (in /usr/libexec/valgrind/vgpreload_memcheck-amd64-linux.so)
==54199==    by 0x401C29: new_env_node (setup_shell_exec.c:19)
==54199==    by 0x401BDC: env_init (setup_shell_exec.c:62)
==54199==    by 0x40138E: main (main.c:152)
==54199== 
==54199== 3,046 bytes in 73 blocks are still reachable in loss record 52 of 77
==54199==    at 0x4848899: malloc (in /usr/libexec/valgrind/vgpreload_memcheck-amd64-linux.so)
==54199==    by 0x409820: ft_strdup (ft_strdup.c:20)
==54199==    by 0x401C61: new_env_node (setup_shell_exec.c:23)
==54199==    by 0x401BDC: env_init (setup_shell_exec.c:62)
==54199==    by 0x40138E: main (main.c:152)
==54199== 
==54199== LEAK SUMMARY:
==54199==    definitely lost: 0 bytes in 0 blocks
==54199==    indirectly lost: 0 bytes in 0 blocks
==54199==      possibly lost: 0 bytes in 0 blocks
==54199==    still reachable: 5,974 bytes in 227 blocks
==54199==         suppressed: 208,262 bytes in 228 blocks
==54199== 
==54199== ERROR SUMMARY: 0 errors from 0 contexts (suppressed: 0 from 0)
--54199-- 
--54199-- used_suppression:     69 readline_leak_2 readline.supp:10 suppressed: 208,262 bytes in 228 blocks
==54199== 
==54199== ERROR SUMMARY: 0 errors from 0 contexts (suppressed: 0 from 0)
==54229== 
==54229== HEAP SUMMARY:
==54229==     in use at exit: 214,254 bytes in 455 blocks
==54229==   total heap usage: 688 allocs, 233 frees, 235,090 bytes allocated
==54229== 
==54229== 1 bytes in 1 blocks are still reachable in loss record 1 of 77
==54229==    at 0x4848899: malloc (in /usr/libexec/valgrind/vgpreload_memcheck-amd64-linux.so)
==54229==    by 0x409820: ft_strdup (ft_strdup.c:20)
==54229==    by 0x405D80: create_cmd (create_cmd.c:28)
==54229==    by 0x4059F6: fill_elements (fill_elements.c:60)
==54229==    by 0x405AAC: set_command (set_command.c:41)
==54229==    by 0x40551F: parsing (parsing.c:138)
==54229==    by 0x4015C0: main (main.c:205)
==54229== 
==54229== 5 bytes in 2 blocks are still reachable in loss record 2 of 77
==54229==    at 0x4848899: malloc (in /usr/libexec/valgrind/vgpreload_memcheck-amd64-linux.so)
==54229==    by 0x409820: ft_strdup (ft_strdup.c:20)
==54229==    by 0x405F2E: fill_args (fill_args.c:33)
==54229==    by 0x405A83: set_command (set_command.c:35)
==54229==    by 0x40551F: parsing (parsing.c:138)
==54229==    by 0x4015C0: main (main.c:205)
==54229== 
==54229== 32 bytes in 1 blocks are still reachable in loss record 21 of 77
==54229==    at 0x4848899: malloc (in /usr/libexec/valgrind/vgpreload_memcheck-amd64-linux.so)
==54229==    by 0x405D44: create_cmd (create_cmd.c:24)
==54229==    by 0x4059F6: fill_elements (fill_elements.c:60)
==54229==    by 0x405AAC: set_command (set_command.c:41)
==54229==    by 0x40551F: parsing (parsing.c:138)
==54229==    by 0x4015C0: main (main.c:205)
==54229== 
==54229== 32 bytes in 2 blocks are still reachable in loss record 22 of 77
==54229==    at 0x4848899: malloc (in /usr/libexec/valgrind/vgpreload_memcheck-amd64-linux.so)
==54229==    by 0x409B4C: ft_calloc (ft_calloc.c:25)
==54229==    by 0x405C54: create_args (create_args.c:34)
==54229==    by 0x405E50: fill_args (fill_args.c:20)
==54229==    by 0x405A83: set_command (set_command.c:35)
==54229==    by 0x40551F: parsing (parsing.c:138)
==54229==    by 0x4015C0: main (main.c:205)
==54229== 
==54229== 80 bytes in 2 blocks are still reachable in loss record 27 of 77
==54229==    at 0x4848899: malloc (in /usr/libexec/valgrind/vgpreload_memcheck-amd64-linux.so)
==54229==    by 0x408A2D: ft_lstnew_cmd (ft_lstnew_cmd.c:19)
==54229==    by 0x405ABD: set_command (set_command.c:42)
==54229==    by 0x40551F: parsing (parsing.c:138)
==54229==    by 0x4015C0: main (main.c:205)
==54229== 
==54229== 1,026 bytes in 73 blocks are still reachable in loss record 46 of 77
==54229==    at 0x4848899: malloc (in /usr/libexec/valgrind/vgpreload_memcheck-amd64-linux.so)
==54229==    by 0x409820: ft_strdup (ft_strdup.c:20)
==54229==    by 0x401C4E: new_env_node (setup_shell_exec.c:22)
==54229==    by 0x401BDC: env_init (setup_shell_exec.c:62)
==54229==    by 0x40138E: main (main.c:152)
==54229== 
==54229== 1,752 bytes in 73 blocks are still reachable in loss record 49 of 77
==54229==    at 0x4848899: malloc (in /usr/libexec/valgrind/vgpreload_memcheck-amd64-linux.so)
==54229==    by 0x401C29: new_env_node (setup_shell_exec.c:19)
==54229==    by 0x401BDC: env_init (setup_shell_exec.c:62)
==54229==    by 0x40138E: main (main.c:152)
==54229== 
==54229== 3,046 bytes in 73 blocks are still reachable in loss record 52 of 77
==54229==    at 0x4848899: malloc (in /usr/libexec/valgrind/vgpreload_memcheck-amd64-linux.so)
==54229==    by 0x409820: ft_strdup (ft_strdup.c:20)
==54229==    by 0x401C61: new_env_node (setup_shell_exec.c:23)
==54229==    by 0x401BDC: env_init (setup_shell_exec.c:62)
==54229==    by 0x40138E: main (main.c:152)
==54229== 
==54229== LEAK SUMMARY:
==54229==    definitely lost: 0 bytes in 0 blocks
==54229==    indirectly lost: 0 bytes in 0 blocks
==54229==      possibly lost: 0 bytes in 0 blocks
==54229==    still reachable: 5,974 bytes in 227 blocks
==54229==         suppressed: 208,280 bytes in 228 blocks
==54229== 
==54229== ERROR SUMMARY: 0 errors from 0 contexts (suppressed: 0 from 0)
--54229-- 
--54229-- used_suppression:     69 readline_leak_2 readline.supp:10 suppressed: 208,280 bytes in 228 blocks
==54229== 
==54229== ERROR SUMMARY: 0 errors from 0 contexts (suppressed: 0 from 0)
==54139== 
==54139== HEAP SUMMARY:
==54139==     in use at exit: 208,178 bytes in 222 blocks
==54139==   total heap usage: 691 allocs, 469 frees, 235,122 bytes allocated
==54139== 
==54139== LEAK SUMMARY:
==54139==    definitely lost: 0 bytes in 0 blocks
==54139==    indirectly lost: 0 bytes in 0 blocks
==54139==      possibly lost: 0 bytes in 0 blocks
==54139==    still reachable: 0 bytes in 0 blocks
==54139==         suppressed: 208,178 bytes in 222 blocks
==54139== 
==54139== ERROR SUMMARY: 0 errors from 0 contexts (suppressed: 0 from 0)
--54139-- 
--54139-- used_suppression:     63 readline_leak_2 readline.supp:10 suppressed: 208,178 bytes in 222 blocks
==54139== 
==54139== ERROR SUMMARY: 0 errors from 0 contexts (suppressed: 0 from 0)
